ID;title;jobCode;department;location;locationType;employmentType;description;minimumExperience;preferredExperience;salaryMin;salaryMax;status;numberOfPositions;hiringManager;recruiter;skillWeight;experienceWeight;educationWeight;locationWeight
f1b2c3d4-e5f6-7890-abcd-ef1234567801;Senior Full-Stack Developer;DEV-001;Engineering;San Francisco, CA;hybrid;full-time;We are looking for an experienced Full-Stack Developer to join our growing engineering team. You will work on enterprise web applications using modern technologies.;5;8;120000;180000;published;2;John Manager;Sarah Recruiter;0.40;0.30;0.20;0.10
f1b2c3d4-e5f6-7890-abcd-ef1234567802;SAP BTP Developer;SAP-001;SAP Practice;New York, NY;onsite;full-time;Join our SAP practice as a BTP Developer. Experience with CAP, Fiori, and S/4HANA integration required.;3;6;100000;150000;published;3;Mike Director;Lisa HR;0.45;0.25;0.20;0.10
f1b2c3d4-e5f6-7890-abcd-ef1234567803;Cloud Solutions Architect;ARCH-001;Architecture;Seattle, WA;remote;full-time;Lead cloud architecture initiatives for enterprise clients. AWS or Azure certification required.;7;10;150000;220000;published;1;Jane CTO;Tom Talent;0.35;0.35;0.20;0.10
f1b2c3d4-e5f6-7890-abcd-ef1234567804;DevOps Engineer;OPS-001;Platform;Boston, MA;hybrid;full-time;Build and maintain CI/CD pipelines and Kubernetes infrastructure. Strong Linux background required.;4;7;110000;160000;published;2;Dave Lead;Amy HR;0.40;0.30;0.15;0.15
f1b2c3d4-e5f6-7890-abcd-ef1234567805;Project Manager - SAP;PM-001;PMO;Austin, TX;onsite;full-time;Manage SAP implementation projects. PMP certification and SAP experience preferred.;5;9;90000;140000;draft;1;Chris VP;Sarah Recruiter;0.30;0.35;0.25;0.10
